No.     Time           Source                Destination           Protocol Length Info
      1 0.000000       63.34.202.188         149.43.220.33         TLSv1.2  495    Application Data
      2 0.000095       149.43.220.33         63.34.202.188         TCP      66     51395 → 443 [ACK] Seq=1 Ack=430 Win=2041 Len=0 TSval=1851774823 TSecr=3648940857
      3 0.717380       12:01:00:00:01:00     Apple_8e:ac:12        ARP      60     149.43.192.1 is at 12:01:00:00:01:00
      4 0.956225       149.43.220.33         149.43.134.83         DNS      80     Standard query 0xb742 A cc-api-data.adobe.io
      5 0.974153       149.43.220.33         199.232.36.81         TCP      54     51392 → 443 [ACK] Seq=1 Ack=1 Win=2049 Len=0
      6 0.975267       149.43.134.83         149.43.220.33         DNS      144    Standard query response 0xb742 A cc-api-data.adobe.io A 34.193.227.236 A 107.22.247.231 A 18.207.85.246 A 54.144.73.197
      7 0.979293       149.43.220.33         34.193.227.236        TCP      78     59297 → 443 [SYN] Seq=0 Win=65535 Len=0 MSS=1460 WS=64 TSval=3856524773 TSecr=0 SACK_PERM=1
      8 0.982845       199.232.36.81         149.43.220.33         TCP      66     [TCP ACKed unseen segment] 443 → 51392 [ACK] Seq=1 Ack=2 Win=290 Len=0 TSval=1879842874 TSecr=1202480411
      9 0.995575       34.193.227.236        149.43.220.33         TCP      74     443 → 59297 [SYN, ACK] Seq=0 Ack=1 Win=26847 Len=0 MSS=1386 SACK_PERM=1 TSval=1140213175 TSecr=3856524773 WS=4096
     10 0.996296       149.43.220.33         34.193.227.236        TCP      66     59297 → 443 [ACK] Seq=1 Ack=1 Win=131904 Len=0 TSval=3856524791 TSecr=1140213175
     11 0.996302       149.43.220.33         34.193.227.236        TLSv1.2  583    Client Hello
     12 1.013012       34.193.227.236        149.43.220.33         TCP      66     443 → 59297 [ACK] Seq=1 Ack=518 Win=28672 Len=0 TSval=1140213193 TSecr=3856524791
     13 1.013013       34.193.227.236        149.43.220.33         TLSv1.2  162    Server Hello
     14 1.013013       34.193.227.236        149.43.220.33         TCP      1440   443 → 59297 [ACK] Seq=97 Ack=518 Win=28672 Len=1374 TSval=1140213193 TSecr=3856524791 [TCP segment of a reassembled PDU]
     15 1.013015       34.193.227.236        149.43.220.33         TCP      1440   443 → 59297 [ACK] Seq=1471 Ack=518 Win=28672 Len=1374 TSval=1140213193 TSecr=3856524791 [TCP segment of a reassembled PDU]
     16 1.013017       34.193.227.236        149.43.220.33         TLSv1.2  820    Certificate
     17 1.013932       149.43.220.33         34.193.227.236        TCP      66     59297 → 443 [ACK] Seq=518 Ack=3599 Win=128256 Len=0 TSval=3856524808 TSecr=1140213193
     18 1.013940       149.43.220.33         34.193.227.236        TCP      66     [TCP Window Update] 59297 → 443 [ACK] Seq=518 Ack=3599 Win=131072 Len=0 TSval=3856524808 TSecr=1140213193
     19 1.015133       34.193.227.236        149.43.220.33         TLSv1.2  404    Server Key Exchange
     20 1.015134       34.193.227.236        149.43.220.33         TLSv1.2  75     Server Hello Done
     21 1.015260       149.43.220.33         34.193.227.236        TCP      66     59297 → 443 [ACK] Seq=518 Ack=3946 Win=130688 Len=0 TSval=3856524810 TSecr=1140213193
     22 1.020413       149.43.220.33         34.193.227.236        TLSv1.2  192    Client Key Exchange, Change Cipher Spec, Encrypted Handshake Message
     23 1.035837       34.193.227.236        149.43.220.33         TCP      66     443 → 59297 [ACK] Seq=3946 Ack=644 Win=28672 Len=0 TSval=1140213216 TSecr=3856524815
     24 1.035838       34.193.227.236        149.43.220.33         TLSv1.2  72     Change Cipher Spec
     25 1.035839       34.193.227.236        149.43.220.33         TLSv1.2  111    Encrypted Handshake Message
     26 1.037100       149.43.220.33         34.193.227.236        TCP      66     59297 → 443 [ACK] Seq=644 Ack=3997 Win=131008 Len=0 TSval=3856524831 TSecr=1140213216
     27 1.037795       149.43.220.33         34.193.227.236        TCP      1440   59297 → 443 [ACK] Seq=644 Ack=3997 Win=131072 Len=1374 TSval=3856524833 TSecr=1140213216 [TCP segment of a reassembled PDU]
     28 1.037801       149.43.220.33         34.193.227.236        TLSv1.2  286    Application Data
     29 1.039421       149.43.220.33         34.193.227.236        TCP      1440   59297 → 443 [ACK] Seq=2238 Ack=3997 Win=131072 Len=1374 TSval=3856524835 TSecr=1140213216 [TCP segment of a reassembled PDU]
     30 1.039424       149.43.220.33         34.193.227.236        TLSv1.2  109    Application Data
     31 1.053011       34.193.227.236        149.43.220.33         TCP      78     [TCP Window Update] 443 → 59297 [ACK] Seq=3997 Ack=644 Win=32768 Len=0 TSval=1140213233 TSecr=3856524831 SLE=2018 SRE=2238
     32 1.053012       34.193.227.236        149.43.220.33         TCP      66     443 → 59297 [ACK] Seq=3997 Ack=2238 Win=32768 Len=0 TSval=1140213234 TSecr=3856524833
     33 1.054011       34.193.227.236        149.43.220.33         TCP      78     [TCP Window Update] 443 → 59297 [ACK] Seq=3997 Ack=2238 Win=36864 Len=0 TSval=1140213234 TSecr=3856524833 SLE=3612 SRE=3655
     34 1.054013       34.193.227.236        149.43.220.33         TCP      66     443 → 59297 [ACK] Seq=3997 Ack=3655 Win=40960 Len=0 TSval=1140213234 TSecr=3856524835
     35 1.057237       34.193.227.236        149.43.220.33         TLSv1.2  278    Application Data
     36 1.057238       34.193.227.236        149.43.220.33         TLSv1.2  97     Encrypted Alert
     37 1.057555       149.43.220.33         34.193.227.236        TCP      66     59297 → 443 [ACK] Seq=3655 Ack=4240 Win=130816 Len=0 TSval=3856524853 TSecr=1140213238
     38 1.058196       149.43.220.33         34.193.227.236        TLSv1.2  97     Encrypted Alert
     39 1.058638       149.43.220.33         34.193.227.236        TCP      66     59297 → 443 [FIN, ACK] Seq=3686 Ack=4240 Win=131072 Len=0 TSval=3856524854 TSecr=1140213238
     40 1.073434       34.193.227.236        149.43.220.33         TCP      66     443 → 59297 [FIN, ACK] Seq=4240 Ack=3686 Win=40960 Len=0 TSval=1140213253 TSecr=3856524853
     41 1.073658       149.43.220.33         34.193.227.236        TCP      66     [TCP Out-Of-Order] 59297 → 443 [FIN, ACK] Seq=3686 Ack=4241 Win=131072 Len=0 TSval=3856524869 TSecr=1140213253
     42 1.073676       34.193.227.236        149.43.220.33         TCP      66     443 → 59297 [ACK] Seq=4241 Ack=3687 Win=40960 Len=0 TSval=1140213254 TSecr=3856524854
     43 1.949378       149.43.220.33         142.250.31.188        TCP      54     51394 → 5228 [ACK] Seq=1 Ack=1 Win=2048 Len=0
     44 1.971385       142.250.31.188        149.43.220.33         TCP      66     [TCP ACKed unseen segment] 5228 → 51394 [ACK] Seq=1 Ack=2 Win=265 Len=0 TSval=2846081376 TSecr=2880263431
     45 3.686868       63.34.202.188         149.43.220.33         TLSv1.2  498    Application Data
     46 3.686987       149.43.220.33         63.34.202.188         TCP      66     51395 → 443 [ACK] Seq=1 Ack=862 Win=2041 Len=0 TSval=1851778510 TSecr=3648944542
     47 9.523882       107.20.137.119        149.43.220.33         TCP      66     443 → 59296 [ACK] Seq=1 Ack=1 Win=13 Len=0 TSval=585720478 TSecr=2431120801
     48 9.524107       149.43.220.33         107.20.137.119        TCP      66     [TCP ACKed unseen segment] 59296 → 443 [ACK] Seq=1 Ack=2 Win=2048 Len=0 TSval=2431135854 TSecr=585664031
     49 11.264198      63.34.202.188         149.43.220.33         TLSv1.2  494    Application Data
     50 11.264290      149.43.220.33         63.34.202.188         TCP      66     51395 → 443 [ACK] Seq=1 Ack=1290 Win=2041 Len=0 TSval=1851786087 TSecr=3648952077
     51 11.673529      54.160.120.76         149.43.220.33         TLSv1.2  575    Application Data
     52 11.673835      149.43.220.33         54.160.120.76         TCP      66     59276 → 443 [ACK] Seq=1 Ack=510 Win=2040 Len=0 TSval=3542466597 TSecr=482393846
     53 11.678353      149.43.220.33         54.160.120.76         TCP      1440   59276 → 443 [ACK] Seq=1 Ack=510 Win=2048 Len=1374 TSval=3542466601 TSecr=482393846 [TCP segment of a reassembled PDU]
     54 11.678360      149.43.220.33         54.160.120.76         TLSv1.2  654    Application Data
     55 11.694468      54.160.120.76         149.43.220.33         TCP      66     443 → 59276 [ACK] Seq=510 Ack=1963 Win=254 Len=0 TSval=482393882 TSecr=3542466601
     56 17.716110      63.34.202.188         149.43.220.33         TLSv1.2  498    Application Data
     57 17.716217      149.43.220.33         63.34.202.188         TCP      66     51395 → 443 [ACK] Seq=1 Ack=1722 Win=2041 Len=0 TSval=1851792539 TSecr=3648958586
     58 19.740035      149.43.220.33         140.82.112.22         TCP      54     51407 → 443 [ACK] Seq=1 Ack=1 Win=2048 Len=0
     59 19.761045      140.82.112.22         149.43.220.33         TCP      66     [TCP ACKed unseen segment] 443 → 51407 [ACK] Seq=1 Ack=2 Win=79 Len=0 TSval=103575509 TSecr=3614193330
     60 19.761200      149.43.220.33         185.199.108.154       TCP      54     51398 → 443 [ACK] Seq=1 Ack=1 Win=2649 Len=0
     61 19.769307      185.199.108.154       149.43.220.33         TCP      66     [TCP ACKed unseen segment] 443 → 51398 [ACK] Seq=1 Ack=2 Win=287 Len=0 TSval=1615083096 TSecr=1750719419
     62 21.600477      149.43.220.33         140.82.114.4          TCP      54     51397 → 443 [ACK] Seq=1 Ack=1 Win=2048 Len=0
     63 21.617474      140.82.114.4          149.43.220.33         TCP      66     [TCP ACKed unseen segment] 443 → 51397 [ACK] Seq=1 Ack=2 Win=170 Len=0 TSval=1070773604 TSecr=2946122693
     64 22.301726      149.43.220.33         185.199.111.133       TCP      54     51399 → 443 [ACK] Seq=1 Ack=1 Win=11580 Len=0
     65 22.311133      63.34.202.188         149.43.220.33         TLSv1.2  453    Application Data
     66 22.311234      149.43.220.33         63.34.202.188         TCP      66     51395 → 443 [ACK] Seq=1 Ack=2109 Win=2041 Len=0 TSval=1851797134 TSecr=3648963177
     67 22.316949      185.199.111.133       149.43.220.33         TCP      66     [TCP ACKed unseen segment] 443 → 51399 [ACK] Seq=1 Ack=2 Win=321 Len=0 TSval=3051650570 TSecr=2596593280
     68 24.576975      107.20.137.119        149.43.220.33         TCP      66     [TCP Dup ACK 47#1] 443 → 59296 [ACK] Seq=1 Ack=1 Win=13 Len=0 TSval=585724241 TSecr=2431135854
     69 24.577154      149.43.220.33         107.20.137.119        TCP      66     [TCP Dup ACK 48#1] [TCP ACKed unseen segment] 59296 → 443 [ACK] Seq=1 Ack=2 Win=2048 Len=0 TSval=2431150907 TSecr=585664031
     70 27.854422      149.43.100.186        149.43.220.33         TCP      78     56206 → 7000 [SYN] Seq=0 Win=65535 Len=0 MSS=1386 WS=64 TSval=647844912 TSecr=0 SACK_PERM=1
     71 27.854685      149.43.220.33         149.43.100.186        TCP      78     7000 → 56206 [SYN, ACK] Seq=0 Ack=1 Win=65535 Len=0 MSS=1460 WS=64 TSval=1938347755 TSecr=647844912 SACK_PERM=1
     72 27.860806      149.43.100.186        149.43.220.33         TCP      66     56206 → 7000 [ACK] Seq=1 Ack=1 Win=131904 Len=0 TSval=647844946 TSecr=1938347755
     73 27.860807      149.43.100.186        149.43.220.33         TCP      107    56206 → 7000 [PSH, ACK] Seq=1 Ack=1 Win=131904 Len=41 TSval=647844946 TSecr=1938347755 [TCP segment of a reassembled PDU]
     74 27.860955      149.43.220.33         149.43.100.186        TCP      66     7000 → 56206 [ACK] Seq=1 Ack=42 Win=131840 Len=0 TSval=1938347761 TSecr=647844946
     75 27.873356      149.43.220.33         149.43.100.186        TCP      1440   7000 → 56206 [ACK] Seq=1 Ack=42 Win=131840 Len=1374 TSval=1938347774 TSecr=647844946 [TCP segment of a reassembled PDU]
     76 27.873394      149.43.220.33         149.43.100.186        TCP      388    7000 → 56206 [PSH, ACK] Seq=1375 Ack=42 Win=131840 Len=322 TSval=1938347774 TSecr=647844946 [TCP segment of a reassembled PDU]
     77 27.876740      149.43.100.186        149.43.220.33         TCP      78     [TCP Dup ACK 72#1] 56206 → 7000 [ACK] Seq=42 Ack=1 Win=131904 Len=0 TSval=647844961 TSecr=1938347761 SLE=1375 SRE=1697
     78 27.876811      149.43.220.33         149.43.100.186        TCP      1440   [TCP Out-Of-Order] 7000 → 56206 [ACK] Seq=1 Ack=42 Win=131840 Len=1374 TSval=1938347777 TSecr=647844961
     79 27.878927      149.43.100.186        149.43.220.33         TCP      66     56206 → 7000 [ACK] Seq=42 Ack=1697 Win=130176 Len=0 TSval=647844963 TSecr=1938347774
     80 27.881089      149.43.100.186        149.43.220.33         TCP      66     56206 → 7000 [FIN, ACK] Seq=42 Ack=1697 Win=131072 Len=0 TSval=647844963 TSecr=1938347774
     81 27.881170      149.43.220.33         149.43.100.186        TCP      66     7000 → 56206 [ACK] Seq=1697 Ack=43 Win=131840 Len=0 TSval=1938347782 TSecr=647844963
     82 27.881335      149.43.220.33         149.43.100.186        TCP      66     7000 → 56206 [FIN, ACK] Seq=1697 Ack=43 Win=131840 Len=0 TSval=1938347782 TSecr=647844963
     83 27.882253      149.43.100.186        149.43.220.33         TCP      78     [TCP Out-Of-Order] 56206 → 7000 [FIN, ACK] Seq=42 Ack=1697 Win=131072 Len=0 TSval=647844966 TSecr=1938347774 SLE=1 SRE=1375
     84 27.886438      149.43.100.186        149.43.220.33         TCP      66     56206 → 7000 [ACK] Seq=43 Ack=1698 Win=131072 Len=0 TSval=647844970 TSecr=1938347782
     85 39.322498      63.34.202.188         149.43.220.33         TLSv1.2  494    Application Data
     86 39.322608      149.43.220.33         63.34.202.188         TCP      66     51395 → 443 [ACK] Seq=1 Ack=2537 Win=2041 Len=0 TSval=1851814145 TSecr=3648980120
     87 39.630472      107.20.137.119        149.43.220.33         TCP      66     [TCP Dup ACK 47#2] 443 → 59296 [ACK] Seq=1 Ack=1 Win=13 Len=0 TSval=585728004 TSecr=2431150907
     88 39.630649      149.43.220.33         107.20.137.119        TCP      66     [TCP Dup ACK 48#2] [TCP ACKed unseen segment] 59296 → 443 [ACK] Seq=1 Ack=2 Win=2048 Len=0 TSval=2431165960 TSecr=585664031
     89 42.190584      63.34.202.188         149.43.220.33         TLSv1.2  490    Application Data
     90 42.190679      149.43.220.33         63.34.202.188         TCP      66     51395 → 443 [ACK] Seq=1 Ack=2961 Win=2041 Len=0 TSval=1851817013 TSecr=3648983083
     91 45.985475      149.43.220.33         199.232.36.81         TCP      54     [TCP Dup ACK 5#1] 51392 → 443 [ACK] Seq=1 Ack=1 Win=2049 Len=0
     92 46.002615      199.232.36.81         149.43.220.33         TCP      66     [TCP Dup ACK 8#1] [TCP ACKed unseen segment] 443 → 51392 [ACK] Seq=1 Ack=2 Win=290 Len=0 TSval=1879887891 TSecr=1202480411
     93 46.974706      149.43.220.33         142.250.31.188        TCP      54     [TCP Dup ACK 43#1] 51394 → 5228 [ACK] Seq=1 Ack=1 Win=2048 Len=0
     94 46.995365      142.250.31.188        149.43.220.33         TCP      66     [TCP Dup ACK 44#1] [TCP ACKed unseen segment] 5228 → 51394 [ACK] Seq=1 Ack=2 Win=265 Len=0 TSval=2846126400 TSecr=2880263431
     95 49.768542      140.82.112.22         149.43.220.33         TLSv1.2  105    [TCP ACKed unseen segment] , Application Data
     96 49.768543      140.82.112.22         149.43.220.33         TCP      66     [TCP ACKed unseen segment] 443 → 51407 [FIN, ACK] Seq=40 Ack=2 Win=79 Len=0 TSval=103605464 TSecr=3614193330
     97 49.768543      140.82.112.22         149.43.220.33         TCP      66     [TCP ACKed unseen segment] [TCP Out-Of-Order] 443 → 51407 [FIN, ACK] Seq=40 Ack=2 Win=79 Len=0 TSval=103605505 TSecr=3614193330
     98 49.768651      149.43.220.33         140.82.112.22         TCP      66     [TCP Previous segment not captured] 51407 → 443 [ACK] Seq=2 Ack=40 Win=2047 Len=0 TSval=3614313381 TSecr=103605464
     99 49.768726      149.43.220.33         140.82.112.22         TCP      66     51407 → 443 [ACK] Seq=2 Ack=41 Win=2047 Len=0 TSval=3614313381 TSecr=103605464
    100 49.768783      149.43.220.33         140.82.112.22         TCP      66     [TCP Dup ACK 99#1] 51407 → 443 [ACK] Seq=2 Ack=41 Win=2047 Len=0 TSval=3614313381 TSecr=103605464
    101 49.768945      149.43.220.33         140.82.112.22         TCP      66     51407 → 443 [FIN, ACK] Seq=2 Ack=41 Win=2048 Len=0 TSval=3614313381 TSecr=103605464
    102 49.784195      140.82.112.22         149.43.220.33         TCP      66     [TCP ACKed unseen segment] 443 → 51407 [ACK] Seq=41 Ack=3 Win=79 Len=0 TSval=103605531 TSecr=3614313381
    103 51.201889      35.186.224.47         149.43.220.33         TCP      66     443 → 51383 [FIN, ACK] Seq=1 Ack=1 Win=272 Len=0 TSval=1099978209 TSecr=4179958277
    104 51.202029      149.43.220.33         35.186.224.47         TCP      54     51383 → 443 [RST] Seq=1 Win=0 Len=0
    105 51.612429      140.82.114.4          149.43.220.33         TLSv1.2  105    [TCP ACKed unseen segment] , Application Data
    106 51.612430      140.82.114.4          149.43.220.33         TCP      66     [TCP ACKed unseen segment] 443 → 51397 [FIN, ACK] Seq=40 Ack=2 Win=170 Len=0 TSval=1070803565 TSecr=2946122693
    107 51.612562      149.43.220.33         140.82.114.4          TCP      66     [TCP Previous segment not captured] 51397 → 443 [ACK] Seq=2 Ack=40 Win=2047 Len=0 TSval=2946242727 TSecr=1070803565
    108 51.612640      149.43.220.33         140.82.114.4          TCP      66     51397 → 443 [ACK] Seq=2 Ack=41 Win=2047 Len=0 TSval=2946242727 TSecr=1070803565
    109 51.612870      149.43.220.33         140.82.114.4          TCP      66     51397 → 443 [FIN, ACK] Seq=2 Ack=41 Win=2048 Len=0 TSval=2946242727 TSecr=1070803565
    110 51.627898      140.82.114.4          149.43.220.33         TCP      66     [TCP ACKed unseen segment] 443 → 51397 [ACK] Seq=41 Ack=3 Win=170 Len=0 TSval=1070803614 TSecr=2946242727
    111 51.695266      54.160.120.76         149.43.220.33         TLSv1.2  575    Application Data
    112 51.695571      149.43.220.33         54.160.120.76         TCP      66     59276 → 443 [ACK] Seq=1963 Ack=1019 Win=2040 Len=0 TSval=3542506617 TSecr=482433884
    113 51.700037      149.43.220.33         54.160.120.76         TCP      1440   59276 → 443 [ACK] Seq=1963 Ack=1019 Win=2048 Len=1374 TSval=3542506622 TSecr=482433884 [TCP segment of a reassembled PDU]
    114 51.700043      149.43.220.33         54.160.120.76         TLSv1.2  654    Application Data
    115 51.715301      54.160.120.76         149.43.220.33         TCP      66     443 → 59276 [ACK] Seq=1019 Ack=3925 Win=269 Len=0 TSval=482433903 TSecr=3542506622
    116 54.682861      107.20.137.119        149.43.220.33         TCP      66     [TCP Dup ACK 47#3] 443 → 59296 [ACK] Seq=1 Ack=1 Win=13 Len=0 TSval=585731767 TSecr=2431165960
    117 54.683030      149.43.220.33         107.20.137.119        TCP      66     [TCP Dup ACK 48#3] [TCP ACKed unseen segment] 59296 → 443 [ACK] Seq=1 Ack=2 Win=2048 Len=0 TSval=2431181012 TSecr=585664031
    118 59.664783      149.43.220.33         63.34.202.188         TLSv1.2  121    Application Data
    119 59.759284      63.34.202.188         149.43.220.33         TCP      66     443 → 51395 [ACK] Seq=2961 Ack=56 Win=115 Len=0 TSval=3649000667 TSecr=1851834486
    120 64.771775      149.43.220.33         185.199.108.154       TCP      54     [TCP Dup ACK 60#1] 51398 → 443 [ACK] Seq=1 Ack=1 Win=2649 Len=0
    121 64.788767      185.199.108.154       149.43.220.33         TCP      66     [TCP Dup ACK 61#1] [TCP ACKed unseen segment] 443 → 51398 [ACK] Seq=1 Ack=2 Win=287 Len=0 TSval=1615128112 TSecr=1750719419
    122 67.319666      149.43.220.33         185.199.111.133       TCP      54     [TCP Dup ACK 64#1] 51399 → 443 [ACK] Seq=1 Ack=1 Win=11580 Len=0
    123 67.335105      185.199.111.133       149.43.220.33         TCP      66     [TCP Dup ACK 67#1] [TCP ACKed unseen segment] 443 → 51399 [ACK] Seq=1 Ack=2 Win=321 Len=0 TSval=3051695586 TSecr=2596593280
    124 69.736480      107.20.137.119        149.43.220.33         TCP      66     [TCP Dup ACK 47#4] 443 → 59296 [ACK] Seq=1 Ack=1 Win=13 Len=0 TSval=585735531 TSecr=2431181012
    125 69.736658      149.43.220.33         107.20.137.119        TCP      66     [TCP Dup ACK 48#4] [TCP ACKed unseen segment] 59296 → 443 [ACK] Seq=1 Ack=2 Win=2048 Len=0 TSval=2431196065 TSecr=585664031
    126 84.789566      107.20.137.119        149.43.220.33         TCP      66     [TCP Dup ACK 47#5] 443 → 59296 [ACK] Seq=1 Ack=1 Win=13 Len=0 TSval=585739294 TSecr=2431196065
    127 84.789747      149.43.220.33         107.20.137.119        TCP      66     [TCP Dup ACK 48#5] [TCP ACKed unseen segment] 59296 → 443 [ACK] Seq=1 Ack=2 Win=2048 Len=0 TSval=2431211117 TSecr=585664031
    128 86.429021      63.34.202.188         149.43.220.33         TLSv1.2  498    Application Data
    129 86.429124      149.43.220.33         63.34.202.188         TCP      66     51395 → 443 [ACK] Seq=56 Ack=3393 Win=2041 Len=0 TSval=1851861250 TSecr=3649027310
    130 90.808445      12:01:00:00:01:00     Apple_8e:ac:12        ARP      60     149.43.192.1 is at 12:01:00:00:01:00
    131 91.005900      149.43.220.33         199.232.36.81         TCP      54     [TCP Dup ACK 5#2] 51392 → 443 [ACK] Seq=1 Ack=1 Win=2049 Len=0
    132 91.015774      199.232.36.81         149.43.220.33         TCP      66     [TCP Dup ACK 8#2] [TCP ACKed unseen segment] 443 → 51392 [ACK] Seq=1 Ack=2 Win=290 Len=0 TSval=1879932904 TSecr=1202480411
    133 91.753220      54.160.120.76         149.43.220.33         TLSv1.2  575    Application Data
    134 91.753531      149.43.220.33         54.160.120.76         TCP      66     59276 → 443 [ACK] Seq=3925 Ack=1528 Win=2040 Len=0 TSval=3542546674 TSecr=482473905
    135 91.758109      149.43.220.33         54.160.120.76         TCP      1440   59276 → 443 [ACK] Seq=3925 Ack=1528 Win=2048 Len=1374 TSval=3542546679 TSecr=482473905 [TCP segment of a reassembled PDU]
    136 91.758114      149.43.220.33         54.160.120.76         TLSv1.2  654    Application Data
    137 91.773092      54.160.120.76         149.43.220.33         TCP      66     443 → 59276 [ACK] Seq=1528 Ack=5887 Win=284 Len=0 TSval=482473960 TSecr=3542546679
    138 91.779118      149.43.220.33         239.255.255.250       SSDP     216    M-SEARCH * HTTP/1.1 
    139 91.998100      149.43.220.33         142.250.31.188        TCP      54     [TCP Dup ACK 43#2] 51394 → 5228 [ACK] Seq=1 Ack=1 Win=2048 Len=0
    140 92.019413      142.250.31.188        149.43.220.33         TCP      66     [TCP Dup ACK 44#2] [TCP ACKed unseen segment] 5228 → 51394 [ACK] Seq=1 Ack=2 Win=265 Len=0 TSval=2846171422 TSecr=2880263431
    141 92.779938      149.43.220.33         239.255.255.250       SSDP     216    M-SEARCH * HTTP/1.1 
    142 93.779192      149.43.220.33         224.0.0.251           MDNS     669    Standard query 0x0000 PTR lb._dns-sd._udp.local, "QU" question PTR _airport._tcp.local, "QU" question PTR _homekit._tcp.local, "QU" question PTR _rdlink._tcp.local, "QU" question PTR _uscan._tcp.local, "QU" question PTR _scanner._tcp.local, "QU" question PTR _ipp._tcp.local, "QU" question PTR _ptp._tcp.local, "QU" question PTR _pdl-datastream._tcp.local, "QU" question PTR _ippusb._tcp.local, "QU" question PTR _printer._tcp.local, "QU" question PTR _ipps._tcp.local, "QU" question PTR _uscans._tcp.local, "QU" question PTR _googlecast._tcp.local, "QU" question PTR _companion-link._tcp.local, "QU" question PTR _apple-mobdev._tcp.local, "QU" question PTR 8d9507a9._sub._apple-mobdev2._tcp.local, "QU" question PTR _apple-pairable._tcp.local, "QU" question PTR _afpovertcp._tcp.local, "QU" question PTR _smb._tcp.local, "QU" question PTR _rfb._tcp.local, "QU" question PTR _adisk._tcp.local, "QU" question ANY Jinseob’s MacBook Pro._airplay._tcp.local, "QU" question ANY 38F9D38EAC12@Jinseob’s MacBook Pro._raop._tcp.local, "QU" question ANY Jinseob’s MacBook Pro._companion-link._tcp.local, "QU" question PTR Jinseob’s MacBook Pro._companion-link._tcp.local SRV 0 0 7000 Jinseobs-MacBook-Pro.local SRV 0 0 7000 Jinseobs-MacBook-Pro.local SRV 0 0 51389 Jinseobs-MacBook-Pro.local OPT
    143 93.779230      fe80::92:ffa0:1ec8:d73c ff02::fb              MDNS     689    Standard query 0x0000 PTR lb._dns-sd._udp.local, "QU" question PTR _airport._tcp.local, "QU" question PTR _homekit._tcp.local, "QU" question PTR _rdlink._tcp.local, "QU" question PTR _uscan._tcp.local, "QU" question PTR _scanner._tcp.local, "QU" question PTR _ipp._tcp.local, "QU" question PTR _ptp._tcp.local, "QU" question PTR _pdl-datastream._tcp.local, "QU" question PTR _ippusb._tcp.local, "QU" question PTR _printer._tcp.local, "QU" question PTR _ipps._tcp.local, "QU" question PTR _uscans._tcp.local, "QU" question PTR _googlecast._tcp.local, "QU" question PTR _companion-link._tcp.local, "QU" question PTR _apple-mobdev._tcp.local, "QU" question PTR 8d9507a9._sub._apple-mobdev2._tcp.local, "QU" question PTR _apple-pairable._tcp.local, "QU" question PTR _afpovertcp._tcp.local, "QU" question PTR _smb._tcp.local, "QU" question PTR _rfb._tcp.local, "QU" question PTR _adisk._tcp.local, "QU" question ANY Jinseob’s MacBook Pro._airplay._tcp.local, "QU" question ANY 38F9D38EAC12@Jinseob’s MacBook Pro._raop._tcp.local, "QU" question ANY Jinseob’s MacBook Pro._companion-link._tcp.local, "QU" question PTR Jinseob’s MacBook Pro._companion-link._tcp.local SRV 0 0 7000 Jinseobs-MacBook-Pro.local SRV 0 0 7000 Jinseobs-MacBook-Pro.local SRV 0 0 51389 Jinseobs-MacBook-Pro.local OPT
    144 93.779293      149.43.220.33         224.0.0.251           MDNS     159    Standard query response 0x0000 PTR _airplay._tcp.local PTR _raop._tcp.local OPT
    145 93.779316      fe80::92:ffa0:1ec8:d73c ff02::fb              MDNS     179    Standard query response 0x0000 PTR _airplay._tcp.local PTR _raop._tcp.local OPT
    146 93.780424      149.43.220.33         239.255.255.250       SSDP     216    M-SEARCH * HTTP/1.1 
    147 94.028452      149.43.220.33         224.0.0.251           MDNS     308    Standard query 0x0000 ANY Jinseob’s MacBook Pro._airplay._tcp.local, "QM" question ANY 38F9D38EAC12@Jinseob’s MacBook Pro._raop._tcp.local, "QM" question ANY Jinseob’s MacBook Pro._companion-link._tcp.local, "QM" question SRV 0 0 7000 Jinseobs-MacBook-Pro.local SRV 0 0 7000 Jinseobs-MacBook-Pro.local SRV 0 0 51389 Jinseobs-MacBook-Pro.local OPT
    148 94.028462      fe80::92:ffa0:1ec8:d73c ff02::fb              MDNS     328    Standard query 0x0000 ANY Jinseob’s MacBook Pro._airplay._tcp.local, "QM" question ANY 38F9D38EAC12@Jinseob’s MacBook Pro._raop._tcp.local, "QM" question ANY Jinseob’s MacBook Pro._companion-link._tcp.local, "QM" question SRV 0 0 7000 Jinseobs-MacBook-Pro.local SRV 0 0 7000 Jinseobs-MacBook-Pro.local SRV 0 0 51389 Jinseobs-MacBook-Pro.local OPT
    149 94.278676      149.43.220.33         224.0.0.251           MDNS     308    Standard query 0x0000 ANY Jinseob’s MacBook Pro._airplay._tcp.local, "QM" question ANY 38F9D38EAC12@Jinseob’s MacBook Pro._raop._tcp.local, "QM" question ANY Jinseob’s MacBook Pro._companion-link._tcp.local, "QM" question SRV 0 0 7000 Jinseobs-MacBook-Pro.local SRV 0 0 7000 Jinseobs-MacBook-Pro.local SRV 0 0 51389 Jinseobs-MacBook-Pro.local OPT
    150 94.278686      fe80::92:ffa0:1ec8:d73c ff02::fb              MDNS     328    Standard query 0x0000 ANY Jinseob’s MacBook Pro._airplay._tcp.local, "QM" question ANY 38F9D38EAC12@Jinseob’s MacBook Pro._raop._tcp.local, "QM" question ANY Jinseob’s MacBook Pro._companion-link._tcp.local, "QM" question SRV 0 0 7000 Jinseobs-MacBook-Pro.local SRV 0 0 7000 Jinseobs-MacBook-Pro.local SRV 0 0 51389 Jinseobs-MacBook-Pro.local OPT
    151 94.530351      149.43.220.33         224.0.0.251           MDNS     1283   Standard query response 0x0000 TXT, cache flush PTR Jinseob’s MacBook Pro._airplay._tcp.local TXT, cache flush PTR 38F9D38EAC12@Jinseob’s MacBook Pro._raop._tcp.local SRV, cache flush 0 0 7000 Jinseobs-MacBook-Pro.local SRV, cache flush 0 0 7000 Jinseobs-MacBook-Pro.local TXT, cache flush PTR _companion-link._tcp.local PTR Jinseob’s MacBook Pro._companion-link._tcp.local TXT SRV, cache flush 0 0 51389 Jinseobs-MacBook-Pro.local AAAA, cache flush fe80::92:ffa0:1ec8:d73c A, cache flush 149.43.220.33 NSEC, cache flush Jinseob’s MacBook Pro._airplay._tcp.local NSEC, cache flush 38F9D38EAC12@Jinseob’s MacBook Pro._raop._tcp.local NSEC, cache flush Jinseob’s MacBook Pro._companion-link._tcp.local NSEC, cache flush Jinseobs-MacBook-Pro.local OPT
    152 94.530361      fe80::92:ffa0:1ec8:d73c ff02::fb              MDNS     1303   Standard query response 0x0000 TXT, cache flush PTR Jinseob’s MacBook Pro._airplay._tcp.local TXT, cache flush PTR 38F9D38EAC12@Jinseob’s MacBook Pro._raop._tcp.local SRV, cache flush 0 0 7000 Jinseobs-MacBook-Pro.local SRV, cache flush 0 0 7000 Jinseobs-MacBook-Pro.local TXT, cache flush PTR _companion-link._tcp.local PTR Jinseob’s MacBook Pro._companion-link._tcp.local TXT SRV, cache flush 0 0 51389 Jinseobs-MacBook-Pro.local AAAA, cache flush fe80::92:ffa0:1ec8:d73c A, cache flush 149.43.220.33 NSEC, cache flush Jinseob’s MacBook Pro._airplay._tcp.local NSEC, cache flush 38F9D38EAC12@Jinseob’s MacBook Pro._raop._tcp.local NSEC, cache flush Jinseob’s MacBook Pro._companion-link._tcp.local NSEC, cache flush Jinseobs-MacBook-Pro.local OPT
    153 94.778334      149.43.220.33         224.0.0.251           MDNS     159    Standard query response 0x0000 PTR _airplay._tcp.local PTR _raop._tcp.local OPT
    154 94.778403      fe80::92:ffa0:1ec8:d73c ff02::fb              MDNS     179    Standard query response 0x0000 PTR _airplay._tcp.local PTR _raop._tcp.local OPT
    155 94.780676      149.43.220.33         239.255.255.250       SSDP     216    M-SEARCH * HTTP/1.1 
    156 94.787928      149.43.220.33         224.0.0.251           MDNS     494    Standard query 0x0000 PTR lb._dns-sd._udp.local, "QM" question PTR _airport._tcp.local, "QM" question PTR _homekit._tcp.local, "QM" question PTR _rdlink._tcp.local, "QM" question PTR _uscan._tcp.local, "QM" question PTR _scanner._tcp.local, "QM" question PTR _ipp._tcp.local, "QM" question PTR _ptp._tcp.local, "QM" question PTR _pdl-datastream._tcp.local, "QM" question PTR _ippusb._tcp.local, "QM" question PTR _printer._tcp.local, "QM" question PTR _ipps._tcp.local, "QM" question PTR _uscans._tcp.local, "QM" question PTR _googlecast._tcp.local, "QM" question PTR _companion-link._tcp.local, "QM" question PTR _apple-mobdev._tcp.local, "QM" question PTR 8d9507a9._sub._apple-mobdev2._tcp.local, "QM" question PTR _apple-pairable._tcp.local, "QM" question PTR _afpovertcp._tcp.local, "QM" question PTR _smb._tcp.local, "QM" question PTR _rfb._tcp.local, "QM" question PTR _adisk._tcp.local, "QM" question PTR Jinseob’s MacBook Pro._companion-link._tcp.local OPT
    157 94.787965      fe80::92:ffa0:1ec8:d73c ff02::fb              MDNS     514    Standard query 0x0000 PTR lb._dns-sd._udp.local, "QM" question PTR _airport._tcp.local, "QM" question PTR _homekit._tcp.local, "QM" question PTR _rdlink._tcp.local, "QM" question PTR _uscan._tcp.local, "QM" question PTR _scanner._tcp.local, "QM" question PTR _ipp._tcp.local, "QM" question PTR _ptp._tcp.local, "QM" question PTR _pdl-datastream._tcp.local, "QM" question PTR _ippusb._tcp.local, "QM" question PTR _printer._tcp.local, "QM" question PTR _ipps._tcp.local, "QM" question PTR _uscans._tcp.local, "QM" question PTR _googlecast._tcp.local, "QM" question PTR _companion-link._tcp.local, "QM" question PTR _apple-mobdev._tcp.local, "QM" question PTR 8d9507a9._sub._apple-mobdev2._tcp.local, "QM" question PTR _apple-pairable._tcp.local, "QM" question PTR _afpovertcp._tcp.local, "QM" question PTR _smb._tcp.local, "QM" question PTR _rfb._tcp.local, "QM" question PTR _adisk._tcp.local, "QM" question PTR Jinseob’s MacBook Pro._companion-link._tcp.local OPT
    158 95.495863      149.43.220.33         224.0.0.251           MDNS     112    Standard query 0x0000 PTR _sleep-proxy._udp.local, "QM" question OPT
    159 95.495938      fe80::92:ffa0:1ec8:d73c ff02::fb              MDNS     132    Standard query 0x0000 PTR _sleep-proxy._udp.local, "QM" question OPT
    160 95.603862      149.43.220.33         224.0.0.251           MDNS     1283   Standard query response 0x0000 TXT, cache flush PTR Jinseob’s MacBook Pro._airplay._tcp.local TXT, cache flush PTR 38F9D38EAC12@Jinseob’s MacBook Pro._raop._tcp.local SRV, cache flush 0 0 7000 Jinseobs-MacBook-Pro.local SRV, cache flush 0 0 7000 Jinseobs-MacBook-Pro.local TXT, cache flush PTR _companion-link._tcp.local PTR Jinseob’s MacBook Pro._companion-link._tcp.local TXT SRV, cache flush 0 0 51389 Jinseobs-MacBook-Pro.local AAAA, cache flush fe80::92:ffa0:1ec8:d73c A, cache flush 149.43.220.33 NSEC, cache flush Jinseob’s MacBook Pro._airplay._tcp.local NSEC, cache flush 38F9D38EAC12@Jinseob’s MacBook Pro._raop._tcp.local NSEC, cache flush Jinseob’s MacBook Pro._companion-link._tcp.local NSEC, cache flush Jinseobs-MacBook-Pro.local OPT
    161 95.603872      fe80::92:ffa0:1ec8:d73c ff02::fb              MDNS     1303   Standard query response 0x0000 TXT, cache flush PTR Jinseob’s MacBook Pro._airplay._tcp.local TXT, cache flush PTR 38F9D38EAC12@Jinseob’s MacBook Pro._raop._tcp.local SRV, cache flush 0 0 7000 Jinseobs-MacBook-Pro.local SRV, cache flush 0 0 7000 Jinseobs-MacBook-Pro.local TXT, cache flush PTR _companion-link._tcp.local PTR Jinseob’s MacBook Pro._companion-link._tcp.local TXT SRV, cache flush 0 0 51389 Jinseobs-MacBook-Pro.local AAAA, cache flush fe80::92:ffa0:1ec8:d73c A, cache flush 149.43.220.33 NSEC, cache flush Jinseob’s MacBook Pro._airplay._tcp.local NSEC, cache flush 38F9D38EAC12@Jinseob’s MacBook Pro._raop._tcp.local NSEC, cache flush Jinseob’s MacBook Pro._companion-link._tcp.local NSEC, cache flush Jinseobs-MacBook-Pro.local OPT
    162 96.780000      149.43.220.33         224.0.0.251           MDNS     1311   Standard query response 0x0000 TXT, cache flush PTR _airplay._tcp.local PTR Jinseob’s MacBook Pro._airplay._tcp.local TXT, cache flush PTR _raop._tcp.local PTR 38F9D38EAC12@Jinseob’s MacBook Pro._raop._tcp.local SRV, cache flush 0 0 7000 Jinseobs-MacBook-Pro.local SRV, cache flush 0 0 7000 Jinseobs-MacBook-Pro.local TXT, cache flush PTR _companion-link._tcp.local PTR Jinseob’s MacBook Pro._companion-link._tcp.local TXT SRV, cache flush 0 0 51389 Jinseobs-MacBook-Pro.local AAAA, cache flush fe80::92:ffa0:1ec8:d73c A, cache flush 149.43.220.33 NSEC, cache flush Jinseob’s MacBook Pro._airplay._tcp.local NSEC, cache flush 38F9D38EAC12@Jinseob’s MacBook Pro._raop._tcp.local NSEC, cache flush Jinseob’s MacBook Pro._companion-link._tcp.local NSEC, cache flush Jinseobs-MacBook-Pro.local OPT
    163 96.780101      fe80::92:ffa0:1ec8:d73c ff02::fb              MDNS     1331   Standard query response 0x0000 TXT, cache flush PTR _airplay._tcp.local PTR Jinseob’s MacBook Pro._airplay._tcp.local TXT, cache flush PTR _raop._tcp.local PTR 38F9D38EAC12@Jinseob’s MacBook Pro._raop._tcp.local SRV, cache flush 0 0 7000 Jinseobs-MacBook-Pro.local SRV, cache flush 0 0 7000 Jinseobs-MacBook-Pro.local TXT, cache flush PTR _companion-link._tcp.local PTR Jinseob’s MacBook Pro._companion-link._tcp.local TXT SRV, cache flush 0 0 51389 Jinseobs-MacBook-Pro.local AAAA, cache flush fe80::92:ffa0:1ec8:d73c A, cache flush 149.43.220.33 NSEC, cache flush Jinseob’s MacBook Pro._airplay._tcp.local NSEC, cache flush 38F9D38EAC12@Jinseob’s MacBook Pro._raop._tcp.local NSEC, cache flush Jinseob’s MacBook Pro._companion-link._tcp.local NSEC, cache flush Jinseobs-MacBook-Pro.local OPT
    164 97.794040      149.43.220.33         224.0.0.251           MDNS     494    Standard query 0x0000 PTR lb._dns-sd._udp.local, "QM" question PTR _airport._tcp.local, "QM" question PTR _homekit._tcp.local, "QM" question PTR _rdlink._tcp.local, "QM" question PTR _uscan._tcp.local, "QM" question PTR _scanner._tcp.local, "QM" question PTR _ipp._tcp.local, "QM" question PTR _ptp._tcp.local, "QM" question PTR _pdl-datastream._tcp.local, "QM" question PTR _ippusb._tcp.local, "QM" question PTR _printer._tcp.local, "QM" question PTR _ipps._tcp.local, "QM" question PTR _uscans._tcp.local, "QM" question PTR _googlecast._tcp.local, "QM" question PTR _companion-link._tcp.local, "QM" question PTR _apple-mobdev._tcp.local, "QM" question PTR 8d9507a9._sub._apple-mobdev2._tcp.local, "QM" question PTR _apple-pairable._tcp.local, "QM" question PTR _afpovertcp._tcp.local, "QM" question PTR _smb._tcp.local, "QM" question PTR _rfb._tcp.local, "QM" question PTR _adisk._tcp.local, "QM" question PTR Jinseob’s MacBook Pro._companion-link._tcp.local OPT
    165 97.794050      fe80::92:ffa0:1ec8:d73c ff02::fb              MDNS     514    Standard query 0x0000 PTR lb._dns-sd._udp.local, "QM" question PTR _airport._tcp.local, "QM" question PTR _homekit._tcp.local, "QM" question PTR _rdlink._tcp.local, "QM" question PTR _uscan._tcp.local, "QM" question PTR _scanner._tcp.local, "QM" question PTR _ipp._tcp.local, "QM" question PTR _ptp._tcp.local, "QM" question PTR _pdl-datastream._tcp.local, "QM" question PTR _ippusb._tcp.local, "QM" question PTR _printer._tcp.local, "QM" question PTR _ipps._tcp.local, "QM" question PTR _uscans._tcp.local, "QM" question PTR _googlecast._tcp.local, "QM" question PTR _companion-link._tcp.local, "QM" question PTR _apple-mobdev._tcp.local, "QM" question PTR 8d9507a9._sub._apple-mobdev2._tcp.local, "QM" question PTR _apple-pairable._tcp.local, "QM" question PTR _afpovertcp._tcp.local, "QM" question PTR _smb._tcp.local, "QM" question PTR _rfb._tcp.local, "QM" question PTR _adisk._tcp.local, "QM" question PTR Jinseob’s MacBook Pro._companion-link._tcp.local OPT
    166 99.844294      107.20.137.119        149.43.220.33         TCP      66     [TCP Dup ACK 47#6] 443 → 59296 [ACK] Seq=1 Ack=1 Win=13 Len=0 TSval=585743057 TSecr=2431211117
    167 99.844474      149.43.220.33         107.20.137.119        TCP      66     [TCP Dup ACK 48#6] [TCP ACKed unseen segment] 59296 → 443 [ACK] Seq=1 Ack=2 Win=2048 Len=0 TSval=2431226172 TSecr=585664031
    168 100.781255     149.43.220.33         224.0.0.251           MDNS     1311   Standard query response 0x0000 TXT, cache flush PTR _airplay._tcp.local PTR Jinseob’s MacBook Pro._airplay._tcp.local TXT, cache flush PTR _raop._tcp.local PTR 38F9D38EAC12@Jinseob’s MacBook Pro._raop._tcp.local SRV, cache flush 0 0 7000 Jinseobs-MacBook-Pro.local SRV, cache flush 0 0 7000 Jinseobs-MacBook-Pro.local TXT, cache flush PTR _companion-link._tcp.local PTR Jinseob’s MacBook Pro._companion-link._tcp.local TXT SRV, cache flush 0 0 51389 Jinseobs-MacBook-Pro.local AAAA, cache flush fe80::92:ffa0:1ec8:d73c A, cache flush 149.43.220.33 NSEC, cache flush Jinseob’s MacBook Pro._airplay._tcp.local NSEC, cache flush 38F9D38EAC12@Jinseob’s MacBook Pro._raop._tcp.local NSEC, cache flush Jinseob’s MacBook Pro._companion-link._tcp.local NSEC, cache flush Jinseobs-MacBook-Pro.local OPT
    169 100.781349     fe80::92:ffa0:1ec8:d73c ff02::fb              MDNS     1331   Standard query response 0x0000 TXT, cache flush PTR _airplay._tcp.local PTR Jinseob’s MacBook Pro._airplay._tcp.local TXT, cache flush PTR _raop._tcp.local PTR 38F9D38EAC12@Jinseob’s MacBook Pro._raop._tcp.local SRV, cache flush 0 0 7000 Jinseobs-MacBook-Pro.local SRV, cache flush 0 0 7000 Jinseobs-MacBook-Pro.local TXT, cache flush PTR _companion-link._tcp.local PTR Jinseob’s MacBook Pro._companion-link._tcp.local TXT SRV, cache flush 0 0 51389 Jinseobs-MacBook-Pro.local AAAA, cache flush fe80::92:ffa0:1ec8:d73c A, cache flush 149.43.220.33 NSEC, cache flush Jinseob’s MacBook Pro._airplay._tcp.local NSEC, cache flush 38F9D38EAC12@Jinseob’s MacBook Pro._raop._tcp.local NSEC, cache flush Jinseob’s MacBook Pro._companion-link._tcp.local NSEC, cache flush Jinseobs-MacBook-Pro.local OPT
    170 104.246373     63.34.202.188         149.43.220.33         TLSv1.2  97     Application Data
    171 104.246480     149.43.220.33         63.34.202.188         TCP      66     51395 → 443 [ACK] Seq=56 Ack=3424 Win=2047 Len=0 TSval=1851879067 TSecr=3649045076
